{
  "schema": "pdfform.data/2",
  "profile": "irs-941@2026-03",
  "values": {
    "ein": "12-3456789",
    "name": "SAMPLE CITY OF EXAMPLEVILLE",
    "address.street": "100 MAIN ST",
    "address.city": "EXAMPLEVILLE",
    "address.state": "OR",
    "address.zip": "97000",
    "quarter": "3",
    "line1.employees": "42",
    "line2.wages": "100000.00",
    "line3.federalIncomeTaxWithheld": "12000.00",
    "line5a.ssWages": "100000.00",
    "line5a.ssTax": "12400.00",
    "line5c.medicareWagesTips": "100000.00",
    "line5c.medicareTax": "2900.00",
    "line5e.totalSsMedicareTax": "15300.00",
    "line6.totalBeforeAdjustments": "27300.00",
    "line10.totalAfterAdjustments": "27300.00",
    "line12.totalTaxes": "27300.00",
    "line13.totalDeposits": "27300.00",
    "line16.depositSchedule": "semiweekly",
    "designee.allowed": "no",
    "signer.name": "PAT EXAMPLE",
    "signer.title": "FINANCE DIRECTOR",
    "signer.phone": "555-555-0100"
  },
  "context": {
    "taxYear": "2026",
    "quarter": "3",
    "liabilityReporting": "semiweekly"
  }
}
