{
  "schema": "pdfform.data/2",
  "profile": "irs-941@2026-03",
  "values": {
    "ein": "987654321",
    "name": "EXAMPLE WATER DISTRICT",
    "tradeName": "EXAMPLE WATER",
    "address.street": "200 RIVER RD STE 5",
    "address.city": "SAMPLETOWN",
    "address.state": "wa",
    "address.zip": "98000-1234",
    "quarter": "3",
    "line1.employees": "7",
    "line2.wages": "30000.00",
    "line3.federalIncomeTaxWithheld": "3000.00",
    "line5a.ssWages": "30000.00",
    "line5a.ssTax": "3720.00",
    "line5c.medicareWagesTips": "30000.00",
    "line5c.medicareTax": "870.00",
    "line5e.totalSsMedicareTax": "4590.00",
    "line6.totalBeforeAdjustments": "7590.00",
    "line7.fractionsOfCents": "-0.02",
    "line10.totalAfterAdjustments": "7589.98",
    "line12.totalTaxes": "7589.98",
    "line13.totalDeposits": "8000.00",
    "line15a.overpayment": "410.02",
    "line15b.overpaymentChoice": "refund",
    "line15c.routingNumber": "123456789",
    "line15d.accountType": "checking",
    "line15e.accountNumber": "000123456789ABC",
    "line16.depositSchedule": "monthly",
    "line16.month1": "2530.00",
    "line16.month2": "2530.00",
    "line16.month3": "2529.98",
    "line16.total": "7589.98",
    "line17.businessClosed": true,
    "line17.finalWageDate": "2026-09-25",
    "designee.allowed": "yes",
    "designee.name": "CHRIS SAMPLE CPA",
    "designee.phone": "555-555-0199",
    "designee.pin": "54321",
    "signer.name": "JORDAN EXAMPLE",
    "signer.title": "GENERAL MANAGER",
    "signer.phone": "555-555-0150",
    "preparer.name": "CHRIS SAMPLE",
    "preparer.ptin": "P12345678",
    "preparer.firmName": "SAMPLE ACCOUNTING LLC",
    "preparer.firmEin": "11-2233445",
    "preparer.address": "300 OAK AVE",
    "preparer.phone": "555-555-0199",
    "preparer.city": "SAMPLETOWN",
    "preparer.state": "WA",
    "preparer.zip": "98000"
  },
  "context": {
    "taxYear": "2026",
    "quarter": "3",
    "liabilityReporting": "monthly"
  }
}
